{
  "schema": "ctxlane.identity-lease-request/v1",
  "client_request_id": "01ARZ3NDEKTSV4RRFFQ69G5FAV",
  "tenant_id": "tenant-acme",
  "work_order_id": "wo_01ARZ3NDEKTSV4RRFFQ69G5FAV",
  "work_order_digest": "sha256:a36dbc1704725260b0896399529c16a86acabb6849bb1c9abeb251d7ffd16e6c",
  "work_order_authorization": {
    "schema": "ctxlane.work-order-authorization/v1",
    "algorithm": "ed25519",
    "key_id": "key-controller-2026-08",
    "client_request_id": "01ARZ3NDEKTSV4RRFFQ69G5FAV",
    "tenant_id": "tenant-acme",
    "work_order_id": "wo_01ARZ3NDEKTSV4RRFFQ69G5FAV",
    "work_order_digest": "sha256:a36dbc1704725260b0896399529c16a86acabb6849bb1c9abeb251d7ffd16e6c",
    "run_id": "run_01ARZ3NDEKTSV4RRFFQ69G5FAV",
    "attempt_id": "attempt_01",
    "role": "implementer",
    "provider": "codex",
    "profile_uid": "profile_01ARZ3NDEKTSV4RRFFQ69G5FAV",
    "profile_ref": "codex:automation-production",
    "repository": "github:acme/payments",
    "workspace_id": "workspace_01ARZ3NDEKTSV4RRFFQ69G5FAV",
    "environment": "production",
    "not_before": "2026-08-21T10:00:00Z",
    "expires_at": "2026-08-21T14:00:00Z",
    "maximum_ttl_seconds": 900,
    "maximum_session_seconds": 14400,
    "signature": "jLtlv6wVNme_sIhGEIcT25hnhY4YrkAwOolb60L22TWa9DRkudNgfEAxrBSrCm3YXjvFIRsujAKizOeO7wjrAw"
  },
  "run_id": "run_01ARZ3NDEKTSV4RRFFQ69G5FAV",
  "attempt_id": "attempt_01",
  "role": "implementer",
  "provider": "codex",
  "profile_uid": "profile_01ARZ3NDEKTSV4RRFFQ69G5FAV",
  "profile_ref": "codex:automation-production",
  "repository": "github:acme/payments",
  "workspace_id": "workspace_01ARZ3NDEKTSV4RRFFQ69G5FAV",
  "environment": "production",
  "requested_ttl_seconds": 900,
  "policy_digest": null
}
